{
  "id": "synthetic-symbolic-map-reflection-grant",
  "subjectId": "synthetic-subject",
  "grantor": {
    "reference": "synthetic-subject",
    "role": "subject"
  },
  "domains": ["symbolic"],
  "purposes": ["personal_reflection"],
  "permittedActions": ["analyze"],
  "recordIds": ["synthetic-symbolic-map", "synthetic-chart-feature"],
  "status": "granted",
  "consentTextVersion": "synthetic-example-only/0.1",
  "createdAt": "2026-01-01T00:00:00Z",
  "expiresAt": "2027-01-01T00:00:00Z",
  "auditReference": "synthetic-example-only"
}
