{
  "id": "consent-example-local-learning-01",
  "subjectId": "example-subject-01",
  "grantor": {
    "reference": "example-subject-01",
    "role": "subject"
  },
  "domains": ["learning", "symbolic"],
  "purposes": ["learning_support"],
  "permittedActions": ["collect", "analyze"],
  "recordIds": [
    "learning-activity-2026-10-20-01",
    "learner-feedback-example-01",
    "promethean-feature-example-01"
  ],
  "timeScope": {
    "startDate": "2026-10-20",
    "endDate": "2026-10-20"
  },
  "status": "granted",
  "consentTextVersion": "metheus-local-learning-consent/0.1.0",
  "createdAt": "2026-10-20T18:00:00-06:00",
  "expiresAt": "2026-11-20T18:00:00-07:00",
  "auditReference": "local-example-only"
}
