{
  "id": "synthetic-birth-input-calculation-grant",
  "subjectId": "synthetic-subject",
  "grantor": {
    "reference": "synthetic-subject",
    "role": "subject"
  },
  "domains": ["birth_chart_inputs"],
  "purposes": ["symbolic_calculation"],
  "permittedActions": ["collect", "analyze"],
  "recordIds": ["synthetic-birth-chart-input"],
  "status": "granted",
  "consentTextVersion": "synthetic-example-only/0.1",
  "createdAt": "2026-01-01T00:00:00Z",
  "expiresAt": "2027-01-01T00:00:00Z",
  "auditReference": "synthetic-example-only"
}
